{
  "$schema": "https://json-schema.org/draft/2020-12/schema",
  "$id": "https://afterburner.local/schemas/deployment-verification-evidence-bundle-locator-pointer/v1",
  "title": "Deployment Verification Evidence Bundle Locator Pointer",
  "type": "object",
  "additionalProperties": false,
  "required": [
    "schema_version",
    "locator_path",
    "bundle_path",
    "artifact_version",
    "profile_name",
    "verification_status"
  ],
  "properties": {
    "schema_version": { "type": "string", "const": "1" },
    "locator_path": { "type": "string", "minLength": 1 },
    "bundle_path": { "type": "string", "minLength": 1 },
    "artifact_version": { "type": "string", "minLength": 1 },
    "profile_name": { "type": "string", "minLength": 1 },
    "verification_status": { "type": "string", "minLength": 1 }
  }
}
