{
  "schema_version": "1",
  "locator_path": "artifacts/deploy/deployment_verification_evidence_bundle_transport_locator.json",
  "bundle_path": "artifacts/deploy/deployment_verification_evidence_bundle.json",
  "artifact_version": "0.2.0",
  "profile_name": "staging-a",
  "verification_status": "passed"
}
